id,sku,short_description,price,list_price,discount,discount_rate,review_count,product_name,brand_id,brand_name
19588948,9988397316724,"Công trình nghiên cứu Tâm lý dân tộc An Nam (Psychologie du Peuple annamite) được Paul Giran - một quan chức cai trị thuộc địa Pháp, xuất bản vào năm 1904 sau hơn ba năm thu thập và tích lũy quan sát ...",92600,109000,16400,15,29,0.0,0.0,
10379317,9369673620818,"Nghệ Thuật Giao Tiếp Để Thành Công (Tái Bản 2019)Nghệ thuật giao tiếp để thành công hướng tới mọi đối tượng độc giả, dù là sinh viên, nhân viên bán hàng, doanh nhân, nhà quản lý, chính trị gia hay ng...",143600,169000,25400,15,47,0.0,0.0,
377644,2607680556780,"Chờ đến mẫu giáo thì đã muộn là cuốn sách bàn về phương pháp giáo dục trẻ trong giai đoạn từ 0 đến 3 tuổi của tác giả Ibuka Masaru, người sáng lập tập đoàn Sony đồng thời là một nhà nghiên cứu giáo dụ...",53000,69000,16000,23,715,0.0,0.0,
347334,2511284177091,"Có Hai Con Mèo Ngồi Bên Cửa Sổ Nhân vật chính thứ nhất tên là Gấu. Nhân vật thứ hai là Tí Hon. Nhân vật thứ ba, tên là…; còn nữa, nhân vật thứ tư, tên là… Để biết tại sao Gấu lại chơi thân với Tí ...",78000,100000,22000,22,1339,0.0,0.0,
278321464,1850465749573,Đồng tiền hạnh phúc là tinh hoa của vốn kiến thức mà Ken Honda đã dạy và học được từ rất nhiều người suốt những năm qua. Cuốn sách là lời giải đáp cho những câu hỏi mà chúng ta luôn trăn trở: Tôi có t...,65000,95000,30000,32,420,0.0,0.0,
278169849,4671211745137,"Trong xã hội của chúng ta, giấc mơ thường bị coi là không quan trọng. Tuy nhiên, nhiều người khẳng định là đã có những trải nghiệm trong khi ngủ mà cho cảm giác rất chân thực. Ví dụ, một người có thể ...",124900,179000,54100,30,2,0.0,0.0,
278160412,9329273344505,"NẾP NHÀ - TỪ GỐC RỄ ĐẾN NGỌN GIÓNếp nhà - Khi những giá trị của gia đình làm nên tất cả""Nếp Nhà - Từ Gốc Rễ Đến Ngọn Gió"" của tác giả Nguyễn Hồng Phương là một tác phẩm sâu sắc, khéo léo lồng ghép g...",239000,239000,0,0,0,0.0,0.0,
278129713,8244026493478,1. Thông tin chi tiếtCông ty phát hành: CÔNG TY TNHH WE UPNhà xuất bản: Dân TríTác giả: WEUPBOOKSNăm xuất bản: 2025Số trang: 1722. Nội dung sách:Cuốn sách cung cấp 12 nguyên tắc thực chiến giúp...,139000,139000,0,0,1,0.0,0.0,
278025563,2169545072128,"“Âm thú” là tập truyện vừa của nhà văn trinh thám Nhật Bản Edogawa Ranpo gồm hai truyện lẻ là “Âm thú” (陰獣) và “Trườn đi trong bóng tối” (闇に蠢).Truyện vừa “Âm thú” mang đậm phong cách Ranpo, đầy rẫy n...",123900,169000,45100,27,4,0.0,0.0,
277963698,7640765840906,Sức khỏe và hạnh phúc đã trở thành nỗi ám ảnh của thời hiện đại. Nhiều ngành công nghiệp trị giá tỷ đô la phát 'triển dựa trên việc người ta không ngừng bỏ thời gian và công sức – về mặt tinh thần và ...,276000,345000,69000,20,6,0.0,0.0,
277827033,2169869460753,"Lần Đầu Làm Mẹ - Tổng Hợp Những Kiến Thức Mới Nhất Về Mang Thai Và Sinh Nở (Tái Bản)Giới thiệu tác giảMasato Takeuchi là một bác sĩ sản phụ khoa nổi tiếng người Nhật Bản, được nhiều người biết đến q...",230500,299000,68500,23,435,0.0,0.0,
277770730,7443804216284,"Sức mạnh tâm trí - Chìa khóa chăm sóc sức khỏe từ bên trong Liệu giữa tâm trí và sức khỏe có một sợi dây vô hình gắn kết, hay chúng chỉ đơn giản là hai thực thể riêng biệt đang cùng tồn tại? Có, có c...",168000,220000,52000,24,3,0.0,0.0,
277409592,2941052750818,NXB: NXB Giáo Dục Việt NamTác giả: Nhiều tác giảNăm XB: 2024Số trang: 144 trangHình thức: Bìa mềmKhổ: 17x24cm...,31000,31000,0,0,0,0.0,0.0,
277408894,9365647145374,"SHADOW WORKSách hướng dẫn giải mã bản ngã ẩn giấu và cân bằng năng lượngBạn đã từng che giấu những cảm xúc, những khía cạnh tính cách hay những trải nghiệm khó khăn để hòa nhập với thế giới xung qua...",124000,155000,31000,20,4,0.0,0.0,
277392924,4392176008201,    Dragon Quest - Cuộc Phiêu Lưu Của Dũng Sĩ Dai - Tập 5      Nhà xuất bản : Nhà Xuất Bản Kim Đồng.  Công ty phát hành : NXB Kim Đồng.  Tác giả : Riku Sanjo.  Kích thước : 17.6 x 11.3 x 1.5 ...,69000,69000,0,0,5,0.0,0.0,
277138921,1378723730542,"50 CÂU HỎI VỀ NHÂN SINH QUANTrong dòng chảy không ngừng của cuộc sống, mỗi người đều ít nhất một lần đối diện với những câu hỏi lớn về ý nghĩa của sự tồn tại, về cách ứng xử trong xã hội, hay sự hòa ...",144000,180000,36000,20,4,0.0,0.0,
276981105,2741863699813,     Sách - Dược Sư Tự Sự - Light Novel         Miêu Miêu là một cô gái làm công việc hầu hạ trong cung đình thời phong kiến.         Câu chuyện của chúng ta bắt đầu với việc cô gái từng hành ng...,110000,110000,0,0,12,0.0,0.0,
276829554,1005900779580,"Âm nhạc có thể khiến chúng ta xúc động, kể những câu chuyện về đức tin, sự đau khổ hoặc tình yêu. Âm nhạc phổ biến ở tất cả các nền văn hóa trên thế giới. Nhưng nó đã thay đổi như thế nào suốt nhiều t...",153230,199000,45770,23,8,0.0,0.0,
276525618,6577800978494,Giới thiệuNhững người TV bất ngờ xâm nhập. Một chàng trai độc thoại như thể đang đọc thơ. Một nữ trúc sư xinh đẹp dễ bị đàn ông xâm phạm. Một bà nội trợ đã không ngủ 17 ngày mà vẫn tỉnh táo như thườn...,80000,100000,20000,20,10,0.0,0.0,
276508158,6819480149448,NXB: NXB Giáo Dục Việt NamTác giả: Nhiều tác giảNăm XB: 2024Số trang: 144 trangHình thức: Bìa mềmKhổ: 17x24cm...,29000,29000,0,0,5,0.0,0.0,
276418965,4672559717710,"Giới thiệu sáchTrải qua hơn 30 lần chỉnh lý từ khi ra mắt, 20 năm qua luôn là nền tảng góp phần đào tạo hàng nghìn thầy thuốc, Minh triết Đông y - Vòng tròn của khí của Bành Tử Ích tính cho đến nay v...",216000,320000,104000,33,10,0.0,0.0,
276376962,4633094951223,"P. KOTLER – TIẾP THỊ 6.0: TƯƠNG LAI LÀ TOÀN NHẬPPhilip Kotler, Hermawan Kartajaya, Iwan SetiawanTrong thời đại kỹ thuật số phát triển mạnh mẽ như hiện nay, hình thức marketing đã bước sang một giai đ...",114000,140000,26000,19,11,0.0,0.0,
275354843,7666260908759,"    Phương Pháp Học Tập Feynman - 5 Bước Giúp Bạn Học Nhanh, Nhớ Lâu, Tiến Bộ Vượt Bậc    - Bạn có đang gặp khó khăn trong việc học tập?    - Học nhiều nhưng không nhớ?    - Kiến thức không áp d...",91100,136000,44900,33,20,0.0,0.0,
274728364,2135392048609,"Trong các sách lịch sử cũ của ta , thì "" Đại Việt sử ký toàn thư "" là một bộ sử lớn chép từ Hồng Bàng đến Ất Mão ( 1675) đời vua Gia Tôn nhà Lê. "" Đại Việt sử ký toàn thư "" là bộ sách ...",200700,275000,74300,27,110,0.0,0.0,
272000023,1151113379203,"Ruột ơi là ruột mời gọi chúng ta khám phá một trong những cơ quan phức tạp nhất, quan trọng nhất và có thể nói là diệu kỳ nhất trong cơ thể, nơi cư trú của cả một thế giới sống động – với số lượng đôn...",95200,119000,23800,20,36,0.0,0.0,
271495366,1135652439454,"“Công lý là phẩm hạnh tiên quyết của các thiết chế xã hội, tương tự như vị trí của chân lý đối với các hệ thống tư tưởng.” (trích chương 1). Một lý thuyết về công lý là cuốn sách kinh điển khi bàn về ...",357000,468000,111000,24,20,0.0,0.0,
270625950,9529919489424,"    Liệu Pháp Chữa Bệnh Toàn Thân - Khu Phản Xạ   1. Thu nhận và sử dụng định vị của năm khu phản xạ chính trên cơ thể người, chủ trị và phương pháp mát xa, hình to chữ lớn, đối chiếu hình và chữ,...",117700,135000,17300,13,9,0.0,0.0,
270224573,2182557516257,"    Lịch Sử 11 (Chân Trời Sáng Tạo)   Để chuẩn bị cho năm học mới 2023 - 2024, thì Nhà xuất bản Giáo dục Việt Nam đã chính thức công bố Bộ SGK Lớp 11 - Chân trời sáng tạo tới các giáo viên, học si...",15000,15000,0,0,5,0.0,0.0,
261028263,5329254777257,"Dagon đã biến thành một chú linh đáng sợ…! Dòng nước chảy xiết mang chú lực vô hạn dồn dập tấn công Naobito, Maki, Nanami!! Mặt khác, nhằm lấy lại thể xác Geto, nhóm chú nguyền sư sùng bái anh ta đã đ...",28500,30000,1500,5,93,0.0,0.0,
242424688,7013059422293,"“Ước mơ của mẹ là gì?”“Thì cho chúng mày ăn học đàng hoàng, đầy đủ để mai sau đỡ khổ.”“Không, ước mơ khác cơ.”“Mai sau chúng mày lập gia đình, chọn được đúng người, vợ chồng yêu thương nhau.”“Ước ...",68450,89000,20550,23,138,0.0,0.0,
241899722,8021661489058,"Giới thiệu“Tiểu đường” là căn bệnh rối loạn chuyển hóa cực kì phổ biến trong thế kỉ 21. Tiểu đường type 1, có mức insulin vô cùng thấp, đối lập hoàn toàn tiểu đường type 2, có mức insulin vô cùng cao...",135300,179000,43700,24,19,0.0,0.0,
187827443,2268890187613,"Rất nhiều cái chết trẻ có thể ngăn ngừa được đơn giản bằng những thay đổi trong chế độ ăn và lối sống. Trong cuốn Ăn gì không chết, bác sĩ Michael Greger, bác sĩ, chuyên gia dinh dưỡng nổi tiếng quốc ...",244000,320000,76000,24,54,0.0,0.0,
170706990,4090318162029,Hầu hết mọi người chỉ làm xét nghiệm máu khi gặp vấn đề sức khỏe và cần đến bệnh viện. Nhưng thực tế là xét nghiệm máu tổng quát giúp phát hiện sớm một số bệnh hoặc đưa ra cảnh báo về các bệnh có thể ...,200200,259000,58800,23,60,0.0,0.0,
155115299,6975438012957,Cuốn sách Giải thích chuyên đề thi vào 10 chuyên Tiếng Anh nằm trong bộ sách Giải thích chuyên đề thi vào 10 chuyên. Cuốn sách giúp học sinh củng cố lại kiến thức trọng tâm và mở rộng kiến thức nâng ...,84000,145000,61000,42,66,0.0,0.0,
152743069,6112745731688,"FPT Bí Lục - Khám Phá Văn Hoá Doanh Nghiệp Tại FPT .Cuốn sách là “bí ẩn ""về văn hoá FPT — nơi nhóm tác giả ứng dụng lý thuyết Edgar Schein vào thực trạng hơn 30 năm phát triển của một đại gia công ng...",156500,199000,42500,21,51,0.0,0.0,
132355740,4730534539540,Hành trình của đoàn làm phim “Hồ Chí Minh – Một hành trình” lần theo hành trình tìm đường cứu nước suốt hơn 30 năm của Bác.Câu chuyện “ngày ấy” của Bác và chuyện “bây giờ” của đoàn làm phim được xen ...,104000,125000,21000,17,30,0.0,0.0,
115078652,2298050016289,"Vì tương lại mười năm trồng cây, vì tương lai trăm năm trồng người.Thế nhưng ngày nay, chúng ta thường chỉ chú ý đến việc nâng cao trí lực và thể chất cho các em, nhưng lại bỏ qua một yếu tố vô cùng ...",171200,198000,26800,14,2,0.0,0.0,
106362865,3214385048262,       Mô tả:   Đạo đức kinh là một trong những tác phẩm cổ điển quan trọng nhất trong lịch sử văn hóa nhân loại. Đạo đức kinh tương truyền do Lão Tử biên soạn dưới thời Xuân thu - Chiến quốc.  ...,67600,99000,31400,32,61,0.0,0.0,
100376369,6619875052588,"""Tiếp nối cuốn tiểu thuyết nổi tiếng HAI SỐ PHẬN về William Kane và Abel Rosnovski, Đứa con gái hoang đàng là một câu chuyện được chắp bút của thế hệ tiếp theo. Câu chuyện đầy trớ trêu, trắc trở nhưng...",143000,209000,66000,32,878,0.0,0.0,
87391039,7316957922937,"Thuật Yêu Đương là một trong nhiều tác phẩm nổi tiếng của ông, ra mắt bạn đọc vào năm 1961, khi đó cụ Nguyễn Duy Cần trên 50 tuổi và đã có một gia tài sách khá đồ sộ. Thông thường các nhà văn đều có n...",96000,120000,24000,20,228,0.0,0.0,
74277389,8244450676077,Tập hợp truyện cổ tích và những câu chuyện mang màu sắc thần tiên của nhiều nước trên thế giới. Nó sẽ mở ra trước mắt các em một thế giới tốt đẹp với những điều kỳ diệu – nơi người tốt luôn được chở c...,163200,192000,28800,15,4,0.0,0.0,
52788074,6226602209045,"Khu Vườn Mùa Hạ (Tái Bản 2020)Những tưởng mùa hè năm lớp Sáu sẽ trôi đi trong êm ả, Kiyama, Yamashita và Wakabe đều không ngờ chúng đang đứng trước ngưỡng của cuộc đời. Cuộc gặp gỡ với “ông cụ”, ngườ...",61200,68000,6800,10,17,0.0,0.0,
50277621,4908388204637,Vua Gia LongCuốn sách là công trình biên khảo bằng tiếng Pháp của Marcel Gaultier được xuất bản lần đầu tại Sài Gòn vào năm 1933. Marcel Gaultier (1900-1960) là nhà văn đồng thời là biên tập viên...,118300,159000,40700,26,241,0.0,0.0,
48525992,4394193143306,"Sự Tiến Hóa Của Vật LýHoàn toàn không dùng đến sự phức tạp của toán học, A. Einstein và L. Infeld đã phác họa vô cùng rõ ràng và thuyết phục những bước tiến hóa quan trọng nhất của khoa học vật lý. X...",123000,140000,17000,12,6,0.0,0.0,
278131404,9005228279994,    Ứng Dụng AI Vào Doanh Nghiệp - Những Bài Giảng Của Giáo Tiến Về Nhân Tố Thay Đổi Cuộc Chơi Trong Kỉ Nguyên Mới   THÔNG TIN TÁC GIẢ   Hoàng Nam Tiến    Là con trai của một chiến tướng (tướng ...,217300,286000,68700,24,5,0.0,0.0,
278106457,1214454178965,"Quả Ngọt Năm Tháng.“Đinh Tiểu Mật, đừng có lạc đường nữa.” “Nếu vẫn lạc thì sao?” “Anh sẽ chờ em ở nguyên chỗ cũ.”Quả Ngọt Năm Tháng xoay quanh mối tình thanh xuân vườn trường kéo dài từ cấp hai đến...",280020,359000,78980,22,12,0.0,0.0,
278100335,9377484766269,"Tử Tinh và Tư Nam là đôi bạn thân từ nhỏ, nhưng lại giống như hai cực nam châm trái dấu. Tử Tinh hoạt bát, tinh nghịch, tươi sáng như ánh sao lấp lánh. Còn cậu bạn thân Tư Nam, lại mang vẻ ngoài điềm ...",140000,175000,35000,20,10,0.0,0.0,
278055553,4330866515781,Cuốn “Khung Hoạch Định Chiến Lược” là cẩm nang toàn diện dành cho các nhà lãnh đạo và quản trị cấp cao muốn xây dựng chiến lược bài bản và hiệu quả. Sách hệ thống hóa các khái niệm nền tảng về hoạch đ...,223600,290000,66400,23,2,0.0,0.0,
278055537,9911565732870,"Tác phẩm “Những tinh túy chọn lọc trong kinh tạng NIKĀYA” được viết bởi Glenn Wallis, tiến sĩ Phật học Đại học Harvard, trình bày về những giáo lý cốt lõi của Đức Phật được chọn lọc trong kinh điển Ph...",197300,225000,27700,12,7,0.0,0.0,
277998254,8118216672567,"Amy Leatheran - người kể chuyện chính của chúng ta - nhận được lời mời đến một khu khảo cổ ở Iraq, để chăm sóc cho vợ của vị tiến sĩ dẫn đoàn Leidner. Quý cô Louise Leidner đang lâm vào khủng hoảng vì...",106000,130000,24000,18,11,0.0,0.0,
277967046,3339545181976,THÔNG TIN TÁC PHẨMTên sản phẩm: Thuyết Âm Mưu + Thuyết Dương MưuTác giả/Dịch giả: Mặc AmNhà xuất bản: NXB Văn HọcNăm xuất bản: 2025Nhà phát hành: Công ty CP SbooksSố trang: 432Khuôn khổ: 13 x ...,170000,236000,66000,28,3,0.0,0.0,
277946326,4598033282987,"Hirayasumi 5 - Mùa xuân thứ hai tại căn nhà cấp bốnIkuta Hiroto là một chàng trai 29 tuổi độc thân, ung dung tự tại, nghề nghiệp tự do. Vốn bản tính tốt bụng, Hiroto được một bà cụ tặng nguyên cho că...",57800,68000,10200,15,4,0.0,0.0,
277837126,7551833318976,"Tây du ký ra đời như thế nào? Chuyện là thời Đại Đường thịnh thế, muôn nước đến chầu, thương mại phát triển, nhưng nhà sư Huyền Trang mua hàng quốc tế khó khăn, đành ra nước ngoài tự tay nhập hàng, từ...",180000,225000,45000,20,2,0.0,0.0,
277527674,3630369939102,"Tác giả: Hisa TakanoDịch giả: Thế ĐăngKhổ sách: 13x19cmSố trang: 192Giá bán: 50,000 VNĐISBN: 978-604-1-26708-4 | Barcode: 8934974208105NXB TrẻNPH: NXB TrẻIn lần thứ 1 năm 2025Giới thiệu tóm t...",44900,50000,5100,10,1,0.0,0.0,
276900244,5432676511533,"“Chim Sẻ Du Ký” là một dự án sách tranh minh họa thiếu nhi, với bối cảnh là hành trình phiêu lưu của nhân vật chính trải dọc đất nước Việt Nam.Tác giả của Chim Sẻ Du Ký là họa sĩ người Pháp, anh Olivi...",90000,90000,0,0,2,0.0,0.0,
276497195,8926978175764,"Tóm tắt nội dungSau khi quyển sách đầu tiên, Chia sẻ từ trái tim - 50 Bài giảng nhân quả thiết thực trong cuộc sống của Sa Môn Thích Pháp Hòa, được xuất bản và nhận được sự ủng hộ của đại chúng ở khắ...",143400,188000,44600,24,33,0.0,0.0,
276285600,8707739828752,"Tóm tắt nội dungCâu chuyện mở đầu với bối cảnh ở một thị trấn yên bình, nơi có một phù thuỷ được dân chúng ca tụng là anh hùng. Tuy nhiên, cặp đôi cộng sự kỳ lạ Ashaf trầm tính và Guideau cộc cằn với...",48500,55000,6500,12,1,0.0,0.0,
274930094,1633308287511,"Combo sản phẩm Toán 11 (Sách bài học 1&2, sách bài tập 1&2, sách chuyên đề)Bộ sách Toán 11 - Cùng khám phá là một bước tiếp nối từ những cuốn sách giáo khoa Toán ở các lớp dưới, được biên so...",109010,109010,0,0,5,0.0,0.0,
274845354,6353059963524,"Sapiens - Cuốn sách lịch sử nhân loại bán chạy hàng đầu thế giớiCuốn sách “Sapiens - lược sử loài người"" đã được xuất bản bằng tiếng Do Thái lần đầu vào năm 2011 và sau đó bằng tiếng Anh vào năm 2014...",122900,159000,36100,23,84,0.0,0.0,
274545380,1113198465347,"Các tài liệu khoa học đang cho thấy nồng độ axit uric tăng cao là nguyên nhân gây ra nhiều tình trạng sức khỏe phổ biến như béo phì, kháng insulin, tiểu đường, gan nhiễm mỡ, tăng huyết áp, bệnh tim mạ...",112000,165000,53000,32,23,0.0,0.0,
273983803,7979323797825,"Gồm 6 truyện ngắn: ""Người đàn bà ngoại tình"", ""Kẻ bỏ đạo hay một đầu óc mù mờ"", ""Những người hóa câm"", ""Người khách"", ""Jonas hay nhà nghệ sĩ lúc làm việc"" và ""Hòn đá mọc lên"". Mỗi câu chuyện trong cuố...",114000,130000,16000,12,0,0.0,0.0,
273870867,3168104591892,    Thám Tử Lừng Danh Conan - Tập 102   Jugo Yokomizo tình cờ gặp Chihaya Hagiwara tại bữa tiệc mai mối!   Điều gì hiện lên trong tâm trí Chihaya khi cô chăm chú nhìn Wataru Takagi!?   Chí nguyệ...,25000,25000,0,0,16,0.0,0.0,
273708851,4210041697420,"Người ta chỉ thường nghĩ đến tác động của não bộ là nó ảnh hưởng đến tâm trí, tư duy, cách suy nghĩ, cách quyết định hành động. Nhưng tâm trí, tư duy, hành động lại tác động đến cảm xúc, sức khỏe, dạ ...",144000,188000,44000,23,6,0.0,0.0,
273046864,1083058133480,"Cuộc khủng hoảng này không thuần túy là kinh tế và tài tính, mà còn là triết lý và tâm linh nữa. Nó đưa ta về những câu hỏi phổ quát: cái gì khiến con người hạnh phúc? Cái gì có thể coi là sự tiến bộ ...",107900,155000,47100,30,11,0.0,0.0,
271528700,9180177788178,"Top 1500+ cụm từ tiếng Anh thông dụng theo chủ đề là cuốn sách tổng hợp hơn 1500 cụm từ tiếng Anh thông dụng nhất, giúp người học dễ dàng miêu tả các hoạt động trong đời sống hằng ngày.Bạn có biết nh...",111100,159000,47900,30,10,0.0,0.0,
271162836,2481392284760,"Beartown 2: Chúng tôi đấu với các bạn.“Có những cuộc đấu không diễn ra trên sân băng, mà trong lòng người.”Thị trấn Beartown chìm trong im lặng sau cơn bão scandal ở phần 1. Đội hockey tan rã. Người...",184000,225000,41000,18,88,0.0,0.0,
267208813,6297652889189,"Tuổi Thơ Dữ Dội - Tập 2Giới thiệu tác giảPhùng Quán, một cây bút tài hoa của văn học Việt Nam, đã để lại dấu ấn sâu đậm trong lòng độc giả qua những tác phẩm giàu cảm xúc và ý nghĩa. Ông sở hữu một...",64000,80000,16000,20,372,0.0,0.0,
263677407,9342453985023,"    Tiếng Anh 11 Friends Global - Student Book (2023)   Tiếng Anh 11 Friends Global tiếp nối kiến thức ngôn ngữ lớp 10, chuẩn bị nền cho kiến thức lớp 12   Tiếng Anh 11 Friends Global có đầy đủ c...",62000,62000,0,0,15,0.0,0.0,
263677359,3899802611506,"    Tiếng Anh 11 Friends Global - Workbook   Tiếng Anh 11 Friends Global tiếp nối kiến thức ngôn ngữ lớp 10, chuẩn bị nền cho kiến thức lớp 12   Tiếng Anh 11 Friends Global có đầy đủ các dạng câu...",79000,79000,0,0,13,0.0,0.0,
248544480,3726083489702,"Combo Sách Giáo Trình Chuẩn HSK 2 - Sách Bài Học Và Bài Tập (Bộ 2 Cuốn) - (Tái Bản)Được chia thành 6 cấp độ với tổng cộng 18 cuốn, Giáo trình chuẩn HSK có những đặc điểm nổi bật sau:Kết hợp thi cử v...",312600,386000,73400,19,49,0.0,0.0,
199216988,6115196569908,"Càng bình tĩnh Càng hạnh phúc Tiếp nối thành công rực rỡ của Bạn đắt giá bao nhiêu?, Khí chất bao nhiêu hạnh phúc bấy nhiêu, Không sợ chậm chỉ sợ dừng,… Vãn Tình đã quay trở lại cùng cuốn sách Càng b...",104950,139000,34050,24,883,0.0,0.0,
192909292,4595635353509,Một tên giết người trên chuyến tàu tốc hành Phương Đông được phát hiện đã bị giết chết bởi 12 nhát dao khác nhau. Phải chăng hung thủ là người ngoài hay chính 12 hành khách - vốn có mối thù với hắn - ...,85000,120000,35000,29,125,0.0,0.0,
186286187,3562677301033,Bạn không cần một chức danh để trở thành lãnh đạo. Đó là thông điệp cốt lõi đầy cảm hứng từ cuốn Nhà Lãnh Đạo Không Chức Danh – một tác phẩm của chuyên gia lãnh đạo nổi tiếng toàn cầu Robin Sharma. Tr...,85000,105000,20000,19,175,0.0,0.0,
161310103,2607035585213,Từ vựng IELTS 8.0 - Từ vựng đắt để đạt điểm cao 4 kỹ năng là cuốn sách tổng hợp 15 chủ đề Từ vựng chất lượng giúp bạn đạt điểm cao cả 4 kỹ năng IELTS.ƯU ĐIỂM NỔI BẬT CỦA BỘ SÁCHCuốn sách tổng hợp 1...,99000,135000,36000,27,558,0.0,0.0,
157054862,4461189768396,Nhà tâm lý học nổi tiếng Carol Dweck sau nhiều thập niên nghiên cứu về thành công đã khám phá ra một ý tưởng thực sự mang tính đột phá – sức mạnh tư duy của chúng ta.Mindset - Tâm Lý Học Thành Công s...,146100,199000,52900,27,92,0.0,0.0,
151597233,9260145066367,"i-Learn Smart World là khóa học Anh ngữ 7 cấp độ dành cho học sinh trung học, được phát triển bởi một đội ngũ các tác giả, giáo viên quốc tế và Việt Nam giàu kinh nghiệm để hoàn toàn phù hợp với lớp ...",68000,68000,0,0,19,0.0,0.0,
121372698,6060660066249,"Trong cuộc sống, chắc hẳn chúng ta cũng có những lúc phải đối mặt với bệnh trầm cảm. Điều quan trọng là mọi người sẽ đối mặt và ứng phó với căn bệnh tâm lý ấy như thế nào.Trầm cảm rất nguy hiểm và cầ...",197000,219000,22000,10,0,0.0,0.0,
104651900,9799568018032,GIỚI THIỆU SÁCH CHỦ NGHĨA KHẮC KỶ - SENECA NHỮNG BỨC THƯ ĐẠO ĐỨCChủ Nghĩa Khắc kỷ (Stoicism) là một trường phái triết học cổ đại được sáng lập bởi nhà triết học Zeno xứ Citium vào đầu thế kỷ thứ 3 Tr...,143200,143200,0,0,451,0.0,0.0,
92492870,8534808223013,"Giới thiệuCác bé sẽ có một hành trình thú vị đi tìm đáp án cho câu hỏi “Ai ở sau lưng bạn thế?”. Cuốn sách sử dụng nhiều câu hỏi nhằm tạo hứng thú cho trẻ, giúp trẻ phát triển ngôn ngữ, ngoài ra còn ...",181700,234000,52300,22,287,0.0,0.0,
76776245,3891511574787,"Nghệ Thuật Tư Duy Phản Biện.Bạn có bao giờ nhận ra rằng mình thường tin vào điều gì đó chỉ vì... “mọi người đều nói thế”?Trong thời đại ngập tràn thông tin, ta dễ bị cuốn theo dư luận, tin tức giật ...",84900,129000,44100,34,734,0.0,0.0,
