id,sku,short_description,price,list_price,discount,discount_rate,review_count,product_name,brand_id,brand_name
8886007,3409341057860,"Bốn thập kỷ biến động và ly tán ở Afghanistan, một lối dẫn dắt chân thực bậc thầy, câu chuyện về những số phận bị vùi dập nhưng đầy ám ảnh. Với Ngàn mặt trời rực rỡ, Khaled Hossini đã chứng minh thành...",113400,130000,16600,13,66,0.0,0.0,
3639597,8788183623224,"Bước Chậm Lại Giữa Thế Gian Vội Vã.“Hãy dừng lại một chút giữa thế gian vội vã… để nghe tâm hồn mình còn thổn thức điều gì.”Cuốn sách Bước Chậm Lại Giữa Thế Gian Vội Vã được Đại đức Hae Min, tu sĩ P...",80000,100000,20000,20,4036,0.0,0.0,
278226970,3848939128949,THÔNG TIN PHÁT HÀNHTác giả: Kuroyanagi TetsukoDịch giả: Trương Thùy LanNhà xuất bản: Hội Nhà VănKích thước: 14 x 19 cmSố trang: 200Ngày phát hành: 2025 GIỚI THIỆU SÁCH“Dù thế nào tôi cũng thấ...,124000,155000,31000,20,1,0.0,0.0,
278160119,7171676371082,"Quyết tử với quân đoàn quái nhân, các anh hùng liên tục ngã xuống do vết thương quá nặng. Fubuki kiên trì dùng siêu năng lực… Trong lúc đó, Nhật Luân của Kiếm Thánh Hội bỗng xuất hiện trợ chiến! Garo ...",28500,30000,1500,5,3,0.0,0.0,
278122197,8379863746941,"Nội dung sách:Kỹ thuật cất giấu kho báu của người xưa có thể nói là bao quát vạn vật, sâu rộng uyên thâm, hội tụ tinh hoa văn hóa hàng nghìn năm của dân tộc Trung Hoa. Những người chôn giấu kho báu đ...",145500,209000,63500,30,1,0.0,0.0,
278089743,9537115725025,"Sức khỏe không chỉ là kết quả của di truyền hay may mắn, nó là hệ quả trực tiếp của cách mỗi cá nhân trao đổi chất với thế giới xung quanh. “Good Energy – Năng Lượng Tốt” là lời kêu gọi mạnh mẽ nhằm t...",154500,229000,74500,33,9,0.0,0.0,
278076371,2129387112896,"1. Hồi Ức Hành Trình Vì Hòa Bình - Nguyễn Chí VịnhSách “Hành trình vì hòa bình” có 6 chương, gồm: “Dò đường”, “Chuẩn bị và lên đường”, “Chuyện kể từ châu Phi”, “Nhìn lại và suy ngẫm”, “Hành trình tiếp...",202000,240000,38000,16,7,0.0,0.0,
278074011,8347882812589,"Sau cuộc đấu phép ở nước Xa Trì, thầy trò Đường Tăng lại tiếp tục lên đường và đối mặt với những thử thách mới. Phải làm gì khi gặp bầy thú cưng đi lạc của các thần tiên? Đường Tăng đã vượt ải tình nh...",165550,215000,49450,23,1,0.0,0.0,
278055563,2973097716563,"“Sông Đà: Lịch sử một vùng biên cảnh Việt Nam” là công trình nghiên cứu đồ sộ, một tập đại thành về lịch sử vùng cao phía bắc của nhà sử học Philippe Le Failler về lịch sử khu vực sông Đà – một không ...",308500,399000,90500,23,9,0.0,0.0,
277933562,2596736179819,"“OSHO – Giác Ngộ” là một trong những tác phẩm tiêu biểu, truyền tải trọn vẹn tinh thần triết lý sống đích thực của Osho – bậc thầy tâm linh nổi tiếng thế giới, có ảnh hưởng sâu rộng trong lĩnh vực tri...",130700,189000,58300,31,6,0.0,0.0,
277857894,2148113682868,"Nội dung sách:Sau khi chồng của Tova Sullivan qua đời, bà bắt đầu làm ca đêm tại Thủy cung Vịnh Sowell, lau sàn và dọn dẹp. Bà thích để bản thân mình bận rộn, điều mà bà vẫn luôn làm kể từ khi cậu co...",151400,219000,67600,31,13,0.0,0.0,
277587065,6958885450786,Nếu bạn là một người thích vẽ nguệch ngoạc hoặc thích viết và tự tay trang trí bằng những hình vẽ nhỏ xinh nhưng lại ngại ngần không đủ tự tin để cầm bút – cuốn sách này chính là món quà dành cho bạn....,149000,149000,0,0,0,0.0,0.0,
277581147,3403630714337,"Sau khi ra mắt lần đầu vào năm 2023, ""Xây nhà – Ngàn điều cần biết"" đã nhận được sự đón nhận nồng nhiệt từ đông đảo độc giả, đặc biệt là những anh chị lần đầu xây nhà hay mới bước chân vào lĩnh vực xâ...",369000,369000,0,0,19,0.0,0.0,
277381902,3254708776949,"Tiếng gọi chân trời.“Có những tiếng gọi không vang bằng âm thanh, mà rền lên trong tim.”""Tiếng Gọi Chân Trời"" không kể về một nhân vật cụ thể, mà là tập hợp của nhiều số phận, nhiều mảnh đời trôi dạ...",73000,95000,22000,23,36,0.0,0.0,
277164024,5128050332496,"Đất đai (Ham muốn sở hữu định hình thế giới hiện Đại).“Để sở hữu một thứ gì đó, bạn cần phải biết nó đang ở đâu trước tiên.”Simon Winchester khám phá lịch sử nhân loại thông qua một chủ đề tưởng như...",232000,290000,58000,20,17,0.0,0.0,
276968794,4949895320321,     Truyện - Naruto        Naruto là một loạt manga Nhật Bản được viết và minh họa bởi Kishimoto Masashi. Manga được đăng lần đầu trên tạp chí Weekly Shonen Jump từ tháng 9 năm 1999 đến tháng 11 ...,35000,35000,0,0,4,0.0,0.0,
275215840,2540735949115,    Sách Giáo Khoa Bộ Lớp 6 - Chân Trời Sáng Tạo - Sách Bài Học (Bộ 12 Cuốn) (2023)   Bao Gồm:                                       STT      Tên hàng                1      Công Nghệ...,182400,182400,0,0,7,0.0,0.0,
273135675,3933647006410,Thời đại sự tập trung bị suy giảmViệc ý thức được khả năng chú ý của chúng ta – sự tập trung – đã và đang rạn vỡ là một trong những điều mà chúng ta có thể cảm nhận được khi sống vào đầu thế kỷ 21.N...,165550,215000,49450,23,29,0.0,0.0,
273114488,6671736498096,"Tư Duy Ngược.Trong một thế giới thay đổi chóng mặt, tư duy đột phá đã trở thành kỹ năng tuyệt đối cần thiết. Không còn chỗ cho sự an toàn và lối mòn, thành công chỉ đến với những ai dám “ngược dòng” ...",120000,179000,59000,33,75,0.0,0.0,
272888010,1175993351454,"Gốc rễ của việc làm người là học cách suy nghĩ. Từ điều đó, chúng ta biết học cách để yêu, chia sẻ, khoan dung và cho đi. Nhiệm vụ trước tiên và quan trọng nhất của con người ngay từ khi sinh ra là hi...",145500,209000,63500,30,42,0.0,0.0,
270504803,6031387182316,4 Nguyên Tắc Thực ThiBạn còn nhớ lần gần nhất phải chứng kiến một sáng kiến quan trọng chết dần trong tổ chức của mình không? Các sáng kiến đó bị bóp nghẹt bởi những ưu tiên mang tính cạnh tranh khác...,145300,205000,59700,29,24,0.0,0.0,
205148094,9190228050361,"... Sáng dậy, lên xe đi làm, bốn giờ trong văn phòng hoặc nhà máy, ăn trưa, lên xe về chỗ làm, bốn giờ công việc, chiều, ăn tối, ngủ nghỉ; Thứ Hai Thứ Ba Thứ Tư Thứ Năm Thứ Sáu và thứ Bảy cùng theo nh...",77000,95000,18000,19,55,0.0,0.0,
189940673,9272089535156,"Học Cách Học.Bạn có đang cảm thấy việc học trở nên quá tải, khô khan và thiếu hiệu quả? Bạn dành hàng giờ để học nhồi nhét nhưng kiến thức vẫn ""rơi rụng"" sau đó? Trong một thế giới tri thức bùng nổ, ...",111300,159000,47700,30,53,0.0,0.0,
187843291,7302391711222,"Nhật ký Đặng Thùy Trâm.“Nếu phải chết, tôi vẫn muốn chết trên chiến trường, để máu mình hòa vào đất mẹ.”“Nhật ký Đặng Thùy Trâm” là tập ghi chép chân thực và xúc động của bác sĩ quân y Đặng Thùy Trâ...",72000,90000,18000,20,143,0.0,0.0,
184070223,9594312279888,"“CẢM XÚC” - Chuyển hóa nỗi sợ hãi, giận dữ và ghen tuông thành năng lượng sáng tạo -Từ bao đời nay, chúng ta vẫn thường được dạy hãy đè nén cơn giận, nỗi buồn và vô số những cảm xúc bị gắn mác tiêu c...",150400,188000,37600,20,322,0.0,0.0,
174842858,1363544330591,"Sức Mạnh Của Ngôn TừSử dụng đúng ngôn từ để đạt hiệu quả giao tiếp cao nhất.Nếu bạn cũng giống như hàng triệu người thường ngồi lặng yên trong các cuộc họp, bỏ lỡ nhiều cơ hội thăng tiến, căng thẳng...",88400,108000,19600,18,313,0.0,0.0,
169546325,1916446189367,Hành trình từ 25 đô-la đến 250 trường học dành cho trẻ em trên toàn cầu và câu chuyện phi thường của một CEO nuôi chí thay đổi thế giới bằng giáo dục.Adam Braun bắt đầu làm việc hè tại các quỹ đầu tư...,113800,159000,45200,28,74,0.0,0.0,
165030729,1605330498488,Những Kẻ Âu Lo.“Chúng ta đều mang trong mình những mảnh vỡ. Có người giấu trong im lặng. Có người hét lên giữa một vụ cướp ngân hàng…”Một vụ cướp ngân hàng thất bại. Một con tin không rõ là nạn nhân...,146000,180000,34000,19,156,0.0,0.0,
157255752,4871831566007,"Sức Mạnh Của Hiện Tại được viết một cách súc tích và thâm thuý nên nhiều khi ta chỉ cần đọc một cây hay một đoạn ngắn thì đã cảm thấy vừa đủ, vì quả thực chúng ta cần có không gian để chiêm nghiệm nhữ...",134400,168000,33600,20,288,0.0,0.0,
154245455,4022695906765,"Bộ sách Nghiền Từ Vựng Tiếng Anh - Học Qua Gốc Từ Bằng Hình Ảnh là bộ sách học từ vựng với phương pháp mới nhất, lần đầu tiên xuất hiện tại thị trường Việt Nam: Học theo Gốc Từ. Phương pháp này giúp ...",206000,270000,64000,24,297,0.0,0.0,
111290700,3831800843266,Thế giới ngầm được phản ánh trong tiểu thuyết Bố Già là sự gặp gỡ giữa một bên là ý chí cương cường và nền tảng gia tộc chặt chẽ theo truyền thống mafia xứ Sicily với một bên là xã hội Mỹ nhập nhằng đ...,212500,250000,37500,15,105,0.0,0.0,
104314401,9412023196109,"Câu chuyện trong Bí Mật của May Mắn hấp dẫn như thần thoại với những chân lý thực tế và vĩnh hằng của cuộc sống mang lại cho người đọc niềm tin, hy vọng, những trải nghiệm và lý giải tại sao một số ng...",54400,68000,13600,20,543,0.0,0.0,
75953557,4731802106183,"Tiền bạc có ở khắp mọi nơi, nó ảnh hưởng đến tất cả chúng ta, và khiến phần lớn chúng ta bối rối. Mọi người nghĩ về nó theo những cách hơi khác nhau một chút. Nó mang lại những bài học có thể được áp ...",136080,189000,52920,28,88,0.0,0.0,
57815506,5711422372945,"TƯ DUY NGƯỢC DỊCH CHUYỂN THẾ GIỚIAdam Grant là tác giả cuốn Give and take (tựa tiếng Việt là “Cho và nhận), tác phẩm được The New York Times bình chọn là sách bán chạy nhất. Trong Give and take, Adam ...",138900,178000,39100,22,412,0.0,0.0,
54266567,6455629494886,"NGHĨ GIÀU VÀ LÀM GIÀU – Tác giả: Napoleon HillCuốn sách mở ra một kim chỉ nam cho hành trình thành công, được xem là “đại kinh điển” trong lĩnh vực phát triển bản thân và làm giàu. Napoleon Hill đặt ...",88500,110000,21500,20,1843,0.0,0.0,
45663008,3744250775420,"Khởi đầu bằng một câu chuyện mang tính ngụ ngôn vừa ngắn gọn, vừa dễ hiểu, cuốn sách rút ra một bài học sâu sắc nhưng thật đơn giản cho những ai vẫn đang vật lộn tìm kiếm thành công ở đời: những lời b...",57000,70000,13000,19,1023,0.0,0.0,
32490132,8771459670374,"Hai cuốn sách trước của GS. Phan Văn Trường,  “Một Đời Thương Thuyết” và “Một Đời Quản Trị”, là sự chắt lọc từ những trải nghiệm trong suốt nhiều năm tháng nghề nghiệp của bản thân. Tuy nhiên, đến với...",155200,175000,19800,11,243,0.0,0.0,
10920495,6934252452697,"Trong hơn nửa thế kỉ kể từ ngày ra mắt bạn đọc lần đầu tiên năm 1941, ""Dế Mèn phiêu lưu kí"" là một trong những sáng tác tâm đắc nhất của nhà văn Tô Hoài. Tác phẩm đã được tái bản nhiều lần và được dị...",138000,150000,12000,8,49,0.0,0.0,
10581200,7734142469588,"Dế Mèn Phiêu Lưu Ký (Tái Bản 2019)Ấn bản minh họa màu đặc biệt của Dế Mèn phiêu lưu ký, với phần tranh ruột được in hai màu xanh - đen ấn tượng, gợi không khí đồng thoại.“Một con dế đã từ tay ông th...",48000,50000,2000,4,134,0.0,0.0,
2619499,3753095632928,"​Liễu Phàm Tứ Huấn (Tái Bản 2018)Là cuốn sách được lưu truyền rộng rãi trong dân gian Trung Quốc từ bao đời nay. Liễu Phàm tiên sinh là bậc học rộng, ngay từ nhỏ đã say mê nghiên cứu sách vở, sau đỗ ...",43400,59000,15600,26,285,0.0,0.0,
1702825,9162657193694,"Hóa Thân""Một sáng tỉnh giấc sau những giấc mơ xáo động, Gregor Samsa, nằm trên giường, nhận thấy mình đã biến thành một con côn trùng khổng lồ. Anh nằm ngửa trên cái lưng rắn như thể được bọc giáp sắ...",43200,54000,10800,20,193,0.0,0.0,
1085104,2439541343433,"            Nghệ Thuật Đàm Phán Đỉnh Cao        Nhằm phân tích những diễn biến tâm lý ẩn sau mỗi biểu hiện của chúng ta trong các cuộc thảo luận quan trọng, từ đó đưa ra    những giải pháp khả ...",126600,149000,22400,15,0,0.0,0.0,
278160115,7651604807267,"Những bí ẩn liên tiếp xảy ra tại thành Osaka một ngày mưa! Cạm bẫy nghiệp hỏa nhằm vào những người yêu thích Hideyoshi… Cùng với vụ án, bí mật về số vàng mà Hideyoshi để lại được hé lộ… Và mối quan hệ...",34300,35000,700,2,2,0.0,0.0,
278123448,3468975440610,Xác chết kì lạ được phát hiện trong rừng thủ thần. Một “Mori Kogoro” đã xuất hiện trước ở nhà trọ nơi chúng tôi tới điều tra! Một kẻ xấu giả làm thám tử lừng danh chăng? Chúng tôi quyết định theo dõi ...,33000,35000,2000,6,2,0.0,0.0,
278100492,6117356419016,"""Bí Mật Vị Thế Tài Chính"" là cuốn sách hoàn toàn rất đặc biệt, khác biệt với những cuốn sách khác về chủ đề tài chính cá nhân. Sách hệ thống lại lý luận và keywords về lĩnh vực này. Dù vậy sách không ...",289000,289000,0,0,0,0.0,0.0,
278095719,7853119782179,"Dưới sự sắp đặt của tên đạo tặc áo trắng đó, 6 thám tử lừng danh tề tựu tại “Biệt thự Hoàng hôn”. Họ bị bắt tham gia trò tìm kho báu, trong đó, chỉ kẻ đầu tiên tìm ra báu vật mới sống sót. Tuy nhiên, ...",34300,35000,700,2,2,0.0,0.0,
278000436,4374950010673,"Băng Hải tặc Mũ Rơm đã đặt chân lên đảo Egghead. Ở đó có khu nghiên cứu của Dr. Vegapunk cùng vô số kĩ thuật chưa ai biết tới khiến máu thám hiểm trong người Luffy rần rần kích động!! Trong lúc đó, CP...",29400,30000,600,2,7,0.0,0.0,
277921751,2282757247534,"Cuốn sách phát họa đầy đủ, chân thực quá trình hình thành nhân cách ngay từ thuở thơ ấu của Chủ tịch Hồ Chí Minh.Được viết bởi Sơn Tùng - Nhà văn người Việt Nam với nhiều tác phẩm về lạnh tụ Hồ Chí M...",142600,159000,16400,10,10,0.0,0.0,
277875592,5772847917519,"Búp Sen Xanh“Búp Sen Xanh” là cuốn tiểu thuyết nổi tiếng nhất của nhà văn Sơn Tùng - người đã dành trọn cuộc đời m.ình để viết về Bác Hồ và các vị anh hùng, những nhà cách mạng lỗi lạc của dân tộc. T...",110000,110000,0,0,76,0.0,0.0,
277837132,5821521803661,"Một cặp đôi tới ẩn mình trong một phòng trọ tại Nice với viên kim cương Nam Thập tự, thứ có lẽ mang tới vận rủi cho họ. Một người đàn ông bán áo da trên những vỉa hè ở Nice. Một cặp vợ chồng bí ẩn sốn...",88000,110000,22000,20,4,0.0,0.0,
277722357,3400362142885,Điều gì thúc đẩy hành vi của con người và sự hiểu biết của chúng ta đối với tâm trí của con người đã phát triển như thế nào theo thời gian? Nicky Hayes sẽ cùng bạn đọc tìm ra câu trả lời trên một hành...,160930,209000,48070,23,2,0.0,0.0,
276944781,9447257593018,    Công Cụ Của Những Người Khổng Lồ      Nhà xuất bản : NXB Trẻ.  Công ty phát hành : NXB Trẻ.  Tác giả : Timothy Ferriss.  Kích thước : 23 x 15.5 x 4.2 cm.  Số trang : 844.  Ngày xuất bản...,327850,395000,67150,17,0,0.0,0.0,
276912267,7330184073870,"""Giữa muôn vàn ngã rẽ của cuộc đời, tôi vẫn chọn làm một người kiêu hãnh"" là cuốn sách thứ mười của Vãn Tình được xuất bản bởi thương hiệu Bloom Books, điểm lại những câu nói ""đắt giá"" trong hành trìn...",87200,109000,21800,20,6,0.0,0.0,
275923492,3437238886822,Những tổn thương mà các em phải chịu trong giai đoạn thơ ấu sẽ để lại những hậu quả nghiêm trọng và kéo dài. Với những câu chuyện về sang chấn tuổi thơ và những hệ lụy đau lòng của nó được sắp xếp tro...,230400,288000,57600,20,24,0.0,0.0,
275044457,6015106185494,Nhắc đến tỷ phú John Davison Rockefeller Sr. là nhắc đến sự giàu có tột bậc. Ông Vua dầu mỏ này được xem là người Mỹ giàu có nhất mọi thời đại và người giàu nhất trong lịch sử hiện đại. Không chỉ là d...,126000,175000,49000,28,40,0.0,0.0,
275006070,9595014231640,"GIÁO DỤC GIỚI TÍNH CHO CON TRAIVề cuốn sách Giáo Dục Giới Tính Cho Con Trai""Giáo Dục Giới Tính Cho Con Trai"" là một cuốn sách quan trọng trong lĩnh vực giáo dục và phát triển cá nhân, tập trung vào ...",66000,90000,24000,27,10,0.0,0.0,
274668055,6167337243802,"Cuộc Chiến Vi Mạch“Cuộc Chiến Vi Mạch” là tiểu sử kỹ thuật và chính trị của ngành công nghiệp bán dẫn – thứ định nghĩa sức mạnh quân sự, kinh tế và địa chính trị thời đại mới. Chris Miller dẫn dắt ng...",240000,300000,60000,20,17,0.0,0.0,
273355903,1782383724166,"Giới thiệu tác giảTiến sĩ Shefali Tsabary nhận bằng tiến sĩ chuyên ngành Tâm lý lâm sàng, Đại học Columbia, New York. Bà được tiếp cận với quan điểm phương Đông từ rất sớm và lồng ghép quan điểm đó v...",111400,149000,37600,25,836,0.0,0.0,
272000024,2936371267927,"Jason Barron, MBA, là một nhà lãnh đạo đầy sáng tạo tập trung vào chiến lược sản phẩm số và trải nghiệm người dùng. Ông cũng là đồng sự sáng lập nên công ty khởi nghiệp LowestMed, vốn được RetailMeNot...",151200,189000,37800,20,254,0.0,0.0,
267340226,8612715024610,"Giáo trình ""301 câu đàm thoại tiếng Hoa"" được biên dịch và bổ sung dựa trên cơ sở cuốn sách giáo khoa "" Hán ngữ hội thoại 301"" do các chuyên gia Hán ngữ của học viện ngôn ngữ Bắc kinh biên soạn. Giáo ...",64000,95000,31000,33,8,0.0,0.0,
262977989,9472868482700,"BIẾN KẾ TOÁN KHÔ KHAN TRỞ THÀNH TRÒ CHƠI CON TRẺ, DỄ HIỂU VÀ DỄ ÁP DỤNGĐã bao lần bạn cầm trên tay bảng báo cáo tài chính doanh nghiệp của mình, nhưng chẳng thể nào hiểu nổi? Kế toán và tài chính là...",159000,199000,40000,20,277,0.0,0.0,
251928260,8129699467386,"ÔNG TƯỚNG TÌNH BÁO BÍ ẨN NHỮNG ĐIỆP VỤ SIÊU HẠNGSự hy sinh thầm lặng, những chiến công hiển hách cùng di sản quân sự - chính trị quý giá của vị tướng lừng lẫy Đặng Trần Đức (ông Ba Quốc) - Dân tộc Vi...",94900,118000,23100,20,45,0.0,0.0,
250339500,7449540353865,"Destination B1: Grammar & Vocabulary được thiết kế dành cho những người chuẩn bị thi B1 - FCE. Cuốn sách tập trung vào những kiến thức ngữ pháp, từ vựng tiếng Anh thường xuyên sử dụng trong bài th...",158400,198000,39600,20,39,0.0,0.0,
214186194,1728053178860,"Trí tuệ Do Thái là một cuốn sách tư duy đầy tham vọng trong việc nâng cao khả năng tự học tập, ghi nhớ và phân tích - những điều đã khiến người Do Thái vượt trội lên, chiếm lĩnh những vị trí quan trọn...",134900,189000,54100,29,136,0.0,0.0,
212992705,9584346837398,"Cuốn sách bạn ước cha mẹ mình từng đọc (Và con bạn sẽ vui nếu bạn đọc nó).Bạn có từng cảm thấy:Con bạn dường như ít chia sẻ, và bạn tự hỏi làm thế nào để có thể kết nối thật sâu?Bạn đang dò dẫm...",116000,145000,29000,20,63,0.0,0.0,
201845361,5792133950074,"“Súng, vi trùng và thép: Định mệnh của các xã hội loài người” là cuốn sách khoa học phổ thông thứ hai và nổi tiếng nhất của Jared Diamond, được xuất bản lần đầu trên thế giới vào năm 1997.Cuốn sách đ...",236000,339000,103000,30,126,0.0,0.0,
192125806,8685948240690,"Dạy Con Làm Giàu – Tập 11: Trường Dạy Kinh Doanh Cho Những Người Thích Giúp Đỡ Người Khác.Cuốn sách là phần tiếp theo của series Dạy Con Làm Giàu, tập trung vào mô hình kinh doanh tiếp thị mạng lưới—...",60000,80000,20000,25,57,0.0,0.0,
186876107,8252676954142,Cởi Trói Linh HồnCuốn sách giúp người đọc vượt qua giới hạn của chính mìnhNếu đã và đang loay hoay với câu hỏi “Tôi là ai trong cuộc đời này?” thì Cởi trói linh hồn của tác giả Michael A.Singer là c...,100200,124000,23800,19,46,0.0,0.0,
172206434,2503140228806,"Huyền Thuật Và Các Đạo Sĩ Tây TạngHành trình 12 năm trong đất Phật huyền bíGần 100 năm kể từ ngày ra mắt, Mystyquet et Magiciens du Tibet, cuốn sách vang dội châu Âu của nữ tác giả người Pháp Alexan...",86400,108000,21600,20,104,0.0,0.0,
160759005,9465225365199,CƠ THỂ TỰ CHỮA LÀNH - Thanh lọc để phục hồiCuốn sách thứ 6 trong series #1 bán chạy Cơ Thể Tự Chữa LànhNếu bạn nghĩ rằng mình không cần phải thanh lọc - nếu bạn chắc chắn rằng bạn không thể chứa bất...,200000,295000,95000,32,336,0.0,0.0,
155550591,4286056675035,"DINH DƯỠNG HỌC BỊ THẤT TRUYỀN - Sách bán chạy hơn 500.000 nghìn bảnĐông y nói “thực dược đồng nguyên” - thức ăn và thuốc cùng chung nguồn gốc, hay thức ăn chính là thuốc; thế nên việc ăn uống của ch...",136000,178000,42000,24,383,0.0,0.0,
147920903,1967959392540,"Một Thoáng Ta Rực Rỡ Ở Nhân Gian.“Chúng ta bắt đầu bằng tình yêu, rồi đến cái chết. Nhưng có lẽ, đôi khi, ta cũng bắt đầu bằng sự im lặng…”Một thoáng ta rực rỡ ở nhân gian viết dưới dạng một lá thư ...",108000,135000,27000,20,2079,0.0,0.0,
117238177,5673157495853,"Thắng hạng mục sách hư cấu của Goodreads.Được đưa vào danh sách tổng kết sách hay nhất năm của The Washington Post, Christian Science Monitor, New York Public Library, Boston Globe, Amazon, PureWow, ...",130500,150000,19500,13,13,0.0,0.0,
109505434,7564739312098,"Bạn không thông minh lắm đâu - (Tái bản 2021- Tặng kèm bookmark)Cho dù bạn có đang chọn mua smartphone hay đang quyết định xem nên tin theo chính trị gia nào, thì bạn cũng luôn tự cho mình là một cá ...",106950,139000,32050,23,671,0.0,0.0,
95218447,7297889019391,Kinh Bốn Lĩnh Vực Quán Niệm và kinh Quán Niệm Hơi Thở là hai kinh gối đầu giường của các vị khuất sĩ thời Bụt còn tại thế và là nền tảng của nếp sống thiền tập đạo Bụt.Sách Con Đường Chuyển Hóa của t...,76800,89000,12200,14,5,0.0,0.0,
77982982,4562885391825,"Trí Tuệ Xúc Cảm đã nằm trong danh sách bán chạy nhất của Thời báo New York trong một năm rưỡi, với hơn 5.000.000 bản in trên toàn thế giới bằng 40 ngôn ngữ và đã là sách bán chạy nhất ở nhiều quốc gia...",169100,199000,29900,15,50,0.0,0.0,
16284286,2528351834108,"“Tuổi Thơ Dữ Dội” là một câu chuyện hay, cảm động viết về tuổi thơ. Sách dày 404 trang mà người đọc không bao giờ muốn ngừng lại, bị lôi cuốn vì những nhân vật ngây thơ có, khôn ranh có, anh hùng có, ...",64000,80000,16000,20,54,0.0,0.0,
12138656,6986093891821,Có phải những người chiến thắng các chương trình truyền hình thực tế được trời phú cho trí thông minh và kỹ năng hơn người?Có phải các nhà đầu tư vĩ đại có thể nhìn thấy những điều mà hầu hết mọi ngư...,172000,239000,67000,28,11,0.0,0.0,
8965213,8389747336996,"Trong suốt hơn 20 thế kỷ qua, những lời dạy trong các văn bản linh thiêng cổ xưa đã khiến hầu hết mọi người hiểu nhầm. Chỉ có một số ít người trong lịch sử có thể nhận ra rằng nó thật ra là một câu đố...",214000,238000,24000,10,1,0.0,0.0,
